<?xml version="1.0" encoding="UTF-8"?>
<!DOCTYPE vivero SYSTEM "vivero.dtd">
<vivero>
    <especie siembra="2018">
        <nombre>Litchi</nombre>
        <precio moneda="euro">25</precio>
        <variedad>Kway May Pink</variedad>
        <origen>Filipinas</origen>
        <color_fruto>rojo</color_fruto>
        <color_fruto>rosa</color_fruto>
        <otros_datos>
            <maduración>agosto</maduración>
            <riego>diario</riego>
        </otros_datos>
    </especie>
    <especie siembra="2018">
        <nombre>Longan</nombre>
        <precio moneda="euro">15</precio>
        <variedad>Champoo</variedad>
        <origen>China</origen>
        <color_fruto>marrón</color_fruto>
        <otros_datos>
            <maduración>octubre</maduración>
            <riego>diario</riego>
        </otros_datos>
    </especie>
    <especie siembra="2016">
        <nombre>Litchi</nombre>
        <precio moneda="euro">21</precio>
        <variedad>Mauritius</variedad>
        <origen>Florida</origen>
        <color_fruto>rojo</color_fruto>
        <otros_datos>
            <maduración>agosto</maduración>
            <riego>diario</riego>
        </otros_datos>
    </especie>
</vivero>